{
  "look": "classic",
  "handDrawnSeed": 1,
  "theme": "base",
  "fontFamily": "\"Recursive Variable\", system-ui, -apple-system, \"Segoe UI\", Roboto, \"Helvetica Neue\", Arial, sans-serif",
  "themeVariables": {
    "darkMode": false,
    "background": "#ffffff",
    "fontFamily": "\"Recursive Variable\", system-ui, -apple-system, \"Segoe UI\", Roboto, \"Helvetica Neue\", Arial, sans-serif",
    "fontSize": "16px",
    "textColor": "#1d2330",
    "lineColor": "#4a5363",
    "primaryColor": "#eaf1fb",
    "primaryTextColor": "#1d2330",
    "primaryBorderColor": "#1f5fbf",
    "secondaryColor": "#eaf6ee",
    "secondaryTextColor": "#1d2330",
    "secondaryBorderColor": "#1a7f37",
    "tertiaryColor": "#fff6e0",
    "tertiaryTextColor": "#1d2330",
    "tertiaryBorderColor": "#9a6700",
    "mainBkg": "#eaf1fb",
    "nodeBorder": "#1f5fbf",
    "nodeTextColor": "#1d2330",
    "clusterBkg": "#f6f7f9",
    "clusterBorder": "#8a94a6",
    "edgeLabelBackground": "#ffffff",
    "titleColor": "#1d2330",
    "noteBkgColor": "#fff6e0",
    "noteTextColor": "#1d2330",
    "noteBorderColor": "#9a6700",
    "actorBkg": "#eaf1fb",
    "actorBorder": "#1f5fbf",
    "actorTextColor": "#1d2330",
    "actorLineColor": "#8a94a6",
    "signalColor": "#1d2330",
    "signalTextColor": "#1d2330",
    "labelBoxBkgColor": "#f6f7f9",
    "labelBoxBorderColor": "#8a94a6",
    "labelTextColor": "#1d2330",
    "loopTextColor": "#1d2330",
    "activationBkgColor": "#fff3c4",
    "activationBorderColor": "#1f5fbf",
    "sequenceNumberColor": "#ffffff",
    "classText": "#1d2330",
    "altBackground": "#f6f7f9",
    "compositeBackground": "#f6f7f9",
    "compositeBorder": "#8a94a6",
    "compositeTitleBackground": "#eaf1fb",
    "transitionColor": "#4a5363",
    "transitionLabelColor": "#1d2330",
    "stateLabelColor": "#1d2330",
    "stateBkg": "#eaf1fb",
    "specialStateColor": "#4a5363",
    "errorBkgColor": "#fdecec",
    "errorTextColor": "#c62828",
    "attributeBackgroundColorOdd": "#ffffff",
    "attributeBackgroundColorEven": "#f6f7f9",
    "pie1": "#eaf1fb",
    "pie2": "#eaf6ee",
    "pie3": "#fff6e0",
    "pie4": "#fff3c4",
    "pie5": "#f6f7f9",
    "pie6": "#ffffff",
    "pie7": "#eaf1fb",
    "pie8": "#eaf6ee",
    "pie9": "#fff6e0",
    "pie10": "#fff3c4",
    "pie11": "#f6f7f9",
    "pie12": "#ffffff",
    "pieTitleTextColor": "#1d2330",
    "pieSectionTextColor": "#1d2330",
    "pieLegendTextColor": "#1d2330",
    "pieStrokeColor": "#4a5363",
    "pieOuterStrokeColor": "#4a5363",
    "pieOpacity": "1"
  },
  "htmlLabels": false,
  "securityLevel": "strict",
  "maxTextSize": 5000,
  "maxEdges": 100,
  "flowchart": { "htmlLabels": false, "useMaxWidth": false },
  "sequence": { "htmlLabels": false, "useMaxWidth": false },
  "class": { "htmlLabels": false, "useMaxWidth": false },
  "state": { "htmlLabels": false, "useMaxWidth": false },
  "er": { "htmlLabels": false, "useMaxWidth": false },
  "pie": { "useMaxWidth": false }
}
